[
  {
    "id": "epiglottitis-p0-03-nhs",
    "title": "Epiglottitis",
    "url": "https://www.nhs.uk/conditions/epiglottitis/",
    "organization": "NHS",
    "independence_group": "UK-NHS",
    "type": "public_health_information",
    "jurisdiction": "International",
    "publication_date": null,
    "accessed_at": "2026-10-03",
    "retrieval_status": "page_opened",
    "retrieval_scope": "2025-03-27; actual read: Symptoms; Immediate action; Treatment; Causes; Preventing",
    "claim_verification": "pending",
    "copyright": "Original bilingual education; source rights retained."
  },
  {
    "id": "epiglottitis-p0-03-mayo-causes",
    "title": "Epiglottitis symptoms and causes",
    "url": "https://www.mayoclinic.org/diseases-conditions/epiglottitis/symptoms-causes/syc-20372227",
    "organization": "Mayo Clinic",
    "independence_group": "Mayo-Clinic",
    "type": "public_health_information",
    "jurisdiction": "International",
    "publication_date": null,
    "accessed_at": "2026-10-03",
    "retrieval_status": "page_opened",
    "retrieval_scope": "2022-11-11; actual read: Overview; child/adult symptoms; Causes; Risk factors; Complications; Prevention",
    "claim_verification": "pending",
    "copyright": "Original bilingual education; source rights retained."
  },
  {
    "id": "epiglottitis-p0-03-mayo-care",
    "title": "Epiglottitis diagnosis and treatment",
    "url": "https://www.mayoclinic.org/diseases-conditions/epiglottitis/diagnosis-treatment/drc-20372231",
    "organization": "Mayo Clinic",
    "independence_group": "Mayo-Clinic",
    "type": "public_health_information",
    "jurisdiction": "International",
    "publication_date": null,
    "accessed_at": "2026-10-03",
    "retrieval_status": "page_opened",
    "retrieval_scope": "2022-11-11; actual read: Diagnosis after breathing stable; Helping with breathing; Treating infection",
    "claim_verification": "pending",
    "copyright": "Original bilingual education; source rights retained."
  },
  {
    "id": "epiglottitis-p0-03-msd",
    "title": "Epiglottitis",
    "url": "https://www.msdmanuals.com/professional/ear-nose-and-throat-disorders/oral-and-pharyngeal-disorders/epiglottitis",
    "organization": "MSD Manual",
    "independence_group": "MSD",
    "type": "public_health_information",
    "jurisdiction": "International",
    "publication_date": null,
    "accessed_at": "2026-10-03",
    "retrieval_status": "page_opened",
    "retrieval_scope": "2026-06; actual read: Symptoms and signs; Diagnosis/croup table; Treatment/airway; Prevention",
    "claim_verification": "pending",
    "copyright": "Original bilingual education; source rights retained."
  },
  {
    "id": "epiglottitis-p0-03-rch",
    "title": "Acute upper airway obstruction",
    "url": "https://www.rch.org.au/clinicalguide/guideline_index/Acute_upper_airway_obstruction/",
    "organization": "Royal Children's Hospital Melbourne",
    "independence_group": "RCH",
    "type": "public_health_information",
    "jurisdiction": "International",
    "publication_date": null,
    "accessed_at": "2026-10-03",
    "retrieval_status": "page_opened",
    "retrieval_scope": "2021-03; actual read: Key points; Assessment/differentials; Investigations; Treatment; Discharge",
    "claim_verification": "pending",
    "copyright": "Original bilingual education; source rights retained."
  },
  {
    "id": "epiglottitis-p0-03-aap",
    "title": "Epiglottitis",
    "url": "https://www.healthychildren.org/English/health-issues/conditions/ear-nose-throat/Pages/Epiglottitis.aspx?form=HealthyChildren",
    "organization": "American Academy of Pediatrics",
    "independence_group": "AAP",
    "type": "public_health_information",
    "jurisdiction": "International",
    "publication_date": null,
    "accessed_at": "2026-10-03",
    "retrieval_status": "page_opened",
    "retrieval_scope": "2009-08-01; actual read: Treatment first paragraph; Prevention",
    "claim_verification": "pending",
    "copyright": "Original bilingual education; source rights retained."
  },
  {
    "id": "epiglottitis-p0-03-staywell",
    "title": "Epiglottitis in Children",
    "url": "https://www.nationwidechildrens.org/conditions/health-library/epiglottitis-in-children",
    "organization": "StayWell Company (hosted by Nationwide Children's Hospital)",
    "independence_group": "StayWell",
    "type": "public_health_information",
    "jurisdiction": "International",
    "publication_date": null,
    "accessed_at": "2026-10-03",
    "retrieval_status": "page_opened",
    "retrieval_scope": "2024-02-01; actual read: Diagnosis; Treatment; Complications; Next steps; copyright/author attribution",
    "claim_verification": "pending",
    "copyright": "Original bilingual education; source rights retained."
  },
  {
    "id": "epiglottitis-p0-03-cleveland",
    "title": "Epiglottitis",
    "url": "https://my.clevelandclinic.org/health/diseases/17844-epiglottitis",
    "organization": "Cleveland Clinic",
    "independence_group": "Cleveland-Clinic",
    "type": "public_health_information",
    "jurisdiction": "US",
    "publication_date": "2025-02-03",
    "accessed_at": "2026-10-03",
    "retrieval_status": "page_opened",
    "retrieval_scope": "Management/Treatment; Outlook; Living With; actual full clinical content read",
    "claim_verification": "pending",
    "copyright": "Original bilingual education; source rights retained."
  },
  {
    "id": "epiglottitis-p0-03-bc",
    "title": "Epiglottitis management — Emergency Care BC",
    "url": "https://emergencycarebc.ca/clinical_resource/clinical-summary/epiglottis-management/",
    "organization": "Emergency Care BC",
    "independence_group": "Emergency-Care-BC",
    "type": "clinical_guideline",
    "jurisdiction": "Canada",
    "publication_date": "2020-02-11",
    "accessed_at": "2026-10-03",
    "retrieval_status": "page_opened",
    "retrieval_scope": "Clinical presentations line33: older patients/normal oropharynx; diagnostic process48–50; treatment52–63 and references102–108. Steroid benefit explicitly insufficient. Shared UpToDate upstream.",
    "claim_verification": "pending",
    "copyright": "Original bilingual summary; rights retained."
  },
  {
    "id": "epiglottitis-p0-03-antibiotic-nhs",
    "title": "Antibiotics side effects — NHS",
    "url": "https://www.nhs.uk/medicines/antibiotics/side-effects/",
    "organization": "NHS",
    "independence_group": "UK-NHS",
    "type": "patient_education",
    "jurisdiction": "UK",
    "publication_date": null,
    "accessed_at": "2026-10-03",
    "retrieval_status": "page_opened",
    "retrieval_scope": "Side effects and serious allergic reaction emergency signs. Original page read.",
    "claim_verification": "pending",
    "copyright": "Original bilingual summary; rights retained."
  },
  {
    "id": "epiglottitis-p0-03-antibiotic-cdc",
    "title": "Antibiotic dos and donts — CDC",
    "url": "https://www.cdc.gov/antibiotic-use/about/index.html",
    "organization": "CDC",
    "independence_group": "CDC",
    "type": "patient_education",
    "jurisdiction": "US",
    "publication_date": "2025-09-23",
    "accessed_at": "2026-10-03",
    "retrieval_status": "page_opened",
    "retrieval_scope": "Take exactly as prescribed57–64; adverse effects76–94 nausea/diarrhoea/life-threatening allergy and clinical contact.",
    "claim_verification": "pending",
    "copyright": "Original bilingual summary; rights retained."
  }
]
