[
  {
    "id": "ad-msd-professional",
    "title": "Aortic Dissection — MSD Professional",
    "url": "https://www.msdmanuals.com/professional/cardiovascular-disorders/diseases-of-the-aorta-and-its-branches/aortic-dissection",
    "organization": "MSD Manuals, Farber and Parodi; physician peer review",
    "independence_group": "MSD-MANUALS",
    "type": "professional_reference",
    "jurisdiction": "US",
    "publication_date": null,
    "accessed_at": "2026-10-03",
    "retrieval_status": "page_opened",
    "retrieval_scope": "December2024 review; Classification, pathophysiology, symptoms, diagnosis, surgical repair and long-term management. Not its cited registry reports.",
    "claim_verification": "pending",
    "copyright": "Third-party rights retained. Original patient-facing explanation only; no source full text redistributed."
  },
  {
    "id": "ad-esc-2024",
    "title": "2024 ESC Guidelines for peripheral arterial and aortic diseases",
    "url": "https://academic.oup.com/eurheartj/article/45/36/3538/7738955",
    "organization": "European Society of Cardiology",
    "independence_group": "ESC-GUIDELINES",
    "type": "clinical_guideline",
    "jurisdiction": "EU",
    "publication_date": "2024-08-30",
    "accessed_at": "2026-10-03",
    "retrieval_status": "search_text_retrieved",
    "retrieval_scope": "Retrieved original-publication indexed text of9.3.1 classification and therapeutic intervention including complicated typeB and rupture; direct open failed, no claim of full guideline reading.",
    "claim_verification": "pending",
    "copyright": "Third-party rights retained. Original patient-facing explanation only; no source full text redistributed."
  }
]
