[
  {
    "id": "mi-udmi-2026",
    "title": "Fifth Universal Definition of Myocardial Infarction (2026)",
    "url": "https://academic.oup.com/eurheartj/advance-article/doi/10.1093/eurheartj/ehag101/8766309?login=false",
    "organization": "ESC/ACC/AHA/WHF joint task force",
    "independence_group": "JOINT-UDMI",
    "type": "clinical_guideline",
    "jurisdiction": "MULTI_REGION",
    "publication_date": "2026-08-28",
    "accessed_at": "2026-10-03",
    "retrieval_status": "page_opened",
    "retrieval_scope": "16.1 Recurrent myocardial infarction;14.1 Cardiac troponin; not the entire guideline or cited studies.",
    "claim_verification": "pending",
    "copyright": "Third-party rights retained. Original patient-facing explanation only; no source full text redistributed."
  },
  {
    "id": "mi-msd-acute-2026",
    "title": "Acute Myocardial Infarction — MSD Professional",
    "url": "https://www.msdmanuals.com/professional/cardiovascular-disorders/coronary-artery-disease/acute-myocardial-infarction-mi",
    "organization": "MSD Manuals, Sweis and Jivan; physician peer review",
    "independence_group": "MSD-MANUALS",
    "type": "professional_reference",
    "jurisdiction": "US",
    "publication_date": null,
    "accessed_at": "2026-10-03",
    "retrieval_status": "page_opened",
    "retrieval_scope": "July2026 review; Diagnosis of Acute MI / ECG / cardiac troponin and treatment. Not each reference.",
    "claim_verification": "pending",
    "copyright": "Third-party rights retained. Original patient-facing explanation only; no source full text redistributed."
  }
]
