[
  {
    "id": "neuro-aans-cauda",
    "title": "AANS — Cauda Equina Syndrome",
    "url": "https://www.aans.org/patients/conditions-treatments/cauda-equina-syndrome/",
    "organization": "American Association of Neurological Surgeons",
    "independence_group": "AANS",
    "type": "clinical_guidance",
    "jurisdiction": "US",
    "publication_date": null,
    "accessed_at": "2026-10-03",
    "retrieval_status": "page_opened",
    "retrieval_scope": "Causes; Symptoms; Testing; Treatment; Coping; web open original HTML",
    "claim_verification": "pending",
    "copyright": "Source rights retained; original bilingual synthesis only, no source full text redistributed."
  },
  {
    "id": "neuro-aaos-cauda",
    "title": "AAOS OrthoInfo — Cauda Equina Syndrome",
    "url": "https://www.orthoinfo.org/diseases--conditions/cauda-equina-syndrome/",
    "organization": "American Academy of Orthopaedic Surgeons",
    "independence_group": "AAOS",
    "type": "clinical_guidance",
    "jurisdiction": "US",
    "publication_date": null,
    "accessed_at": "2026-10-03",
    "retrieval_status": "page_opened",
    "retrieval_scope": "Definition; Causes; Symptoms; Examination; Treatment; Living; Bladder/Bowel; web open original HTML",
    "claim_verification": "pending",
    "copyright": "Source rights retained; original bilingual synthesis only, no source full text redistributed."
  },
  {
    "id": "neuro-royalfree-cauda",
    "title": "Royal Free London — Cauda equina syndrome",
    "url": "https://www.royalfree.nhs.uk/patients-and-visitors/patient-information-leaflets/cauda-equina-syndrome",
    "organization": "Royal Free London NHS Foundation Trust",
    "independence_group": "ROYAL-FREE",
    "type": "clinical_guidance",
    "jurisdiction": "GB",
    "publication_date": null,
    "accessed_at": "2026-10-03",
    "retrieval_status": "page_opened",
    "retrieval_scope": "What is CES; Symptoms; What to do; web open original HTML",
    "claim_verification": "pending",
    "copyright": "Source rights retained; original bilingual synthesis only, no source full text redistributed."
  },
  {
    "id": "neuro-nbt-cauda",
    "title": "Same Day Emergency Clinic: Cauda Equina Syndrome",
    "url": "https://www.nbt.nhs.uk/our-services/a-z-services/neurosurgery/neurosurgery-patient-information/same-day-emergency-clinic-sdec-cauda-equina-syndrome-sec",
    "organization": "North Bristol NHS Trust",
    "independence_group": "UK-NBT",
    "type": "clinical_guidance",
    "jurisdiction": "GB",
    "publication_date": null,
    "accessed_at": "2026-10-03",
    "retrieval_status": "page_opened",
    "retrieval_scope": "What is CES; MRI; bladder tests; no operation; new symptoms after discharge. April 2024, NBT003620.",
    "claim_verification": "pending",
    "copyright": "Public original page read and paraphrased; no full text retained."
  },
  {
    "id": "neuro-uclh-nerve-medicines",
    "title": "UCLH — Medicines for nerve pain",
    "url": "https://www.uclh.nhs.uk/patients-and-visitors/patient-information-pages/medicines-neuropathic-pain",
    "organization": "UCLH",
    "independence_group": "UCLH",
    "type": "clinical_guidance",
    "jurisdiction": "GB",
    "publication_date": null,
    "accessed_at": "2026-10-03",
    "retrieval_status": "page_opened",
    "retrieval_scope": "What is neuropathic pain; Gabapentin; Side effects; stopping treatment; original HTML read",
    "claim_verification": "pending",
    "copyright": "Source rights retained; original bilingual synthesis only."
  },
  {
    "id": "neuro-nhs-gabapentin-about",
    "title": "NHS — About gabapentin",
    "url": "https://www.nhs.uk/medicines/gabapentin/about-gabapentin/",
    "organization": "NHS",
    "independence_group": "NHS",
    "type": "clinical_guidance",
    "jurisdiction": "GB",
    "publication_date": null,
    "accessed_at": "2026-10-03",
    "retrieval_status": "page_opened",
    "retrieval_scope": "Introduction; Key facts; original HTML read",
    "claim_verification": "pending",
    "copyright": "Source rights retained; original bilingual synthesis only."
  },
  {
    "id": "neuro-nhs-gabapentin-effects",
    "title": "NHS — Gabapentin side effects",
    "url": "https://www.nhs.uk/medicines/gabapentin/side-effects-of-gabapentin/",
    "organization": "NHS",
    "independence_group": "NHS",
    "type": "clinical_guidance",
    "jurisdiction": "GB",
    "publication_date": null,
    "accessed_at": "2026-10-03",
    "retrieval_status": "page_opened",
    "retrieval_scope": "Sleepiness/dizziness; Long-term side effects; original HTML read",
    "claim_verification": "pending",
    "copyright": "Source rights retained; original bilingual synthesis only."
  },
  {
    "id": "neuro-msktc-bowel",
    "title": "MSKTC — Bowel function after spinal cord injury",
    "url": "https://msktc.org/sci/factsheets/bowel-function-after-spinal-cord-injury",
    "organization": "MSKTC",
    "independence_group": "MSKTC",
    "type": "clinical_guidance",
    "jurisdiction": "US",
    "publication_date": null,
    "accessed_at": "2026-10-03",
    "retrieval_status": "page_opened",
    "retrieval_scope": "Individual bowel program; Diet and fluids; Medicines; original HTML read",
    "claim_verification": "pending",
    "copyright": "Source rights retained; original bilingual synthesis only."
  },
  {
    "id": "neuro-nhs-laxatives",
    "title": "NHS — Laxatives",
    "url": "https://www.nhs.uk/medicines/laxatives/",
    "organization": "NHS",
    "independence_group": "NHS",
    "type": "clinical_guidance",
    "jurisdiction": "GB",
    "publication_date": null,
    "accessed_at": "2026-10-03",
    "retrieval_status": "page_opened",
    "retrieval_scope": "Types; Side effects; Which type; original HTML read",
    "claim_verification": "pending",
    "copyright": "Source rights retained; original bilingual synthesis only."
  },
  {
    "id": "neuro-nhs-digestion",
    "title": "NHS — Good foods to help digestion",
    "url": "https://www.nhs.uk/Live-well/eat-well/digestive-health/good-foods-to-help-your-digestion/",
    "organization": "NHS",
    "independence_group": "NHS",
    "type": "clinical_guidance",
    "jurisdiction": "GB",
    "publication_date": null,
    "accessed_at": "2026-10-03",
    "retrieval_status": "page_opened",
    "retrieval_scope": "Fibre; Fluids; original HTML read",
    "claim_verification": "pending",
    "copyright": "Source rights retained; original bilingual synthesis only."
  },
  {
    "id": "neuro-mayo-neurogenic-bowel",
    "title": "MAYO — Neurogenic bladder and bowel management",
    "url": "https://www.mayoclinic.org/tests-procedures/neurogenic-bladder-bowel-management/about/pac-20394763",
    "organization": "MAYO",
    "independence_group": "MAYO",
    "type": "clinical_guidance",
    "jurisdiction": "US",
    "publication_date": null,
    "accessed_at": "2026-10-03",
    "retrieval_status": "page_opened",
    "retrieval_scope": "Overview; Bowel management options; original HTML read",
    "claim_verification": "pending",
    "copyright": "Source rights retained; original bilingual synthesis only."
  },
  {
    "id": "neuro-merck-plexus",
    "title": "MERCK — Brachial and lumbosacral plexus disorders",
    "url": "https://www.merckmanuals.com/professional/neurologic-disorders/peripheral-nervous-system-and-motor-unit-disorders/brachial-plexus-and-lumbosacral-plexus-disorders",
    "organization": "MERCK",
    "independence_group": "MERCK",
    "type": "clinical_guidance",
    "jurisdiction": "US",
    "publication_date": null,
    "accessed_at": "2026-10-03",
    "retrieval_status": "page_opened",
    "retrieval_scope": "Definition; Symptoms; Diagnosis; original HTML read",
    "claim_verification": "pending",
    "copyright": "Source rights retained; original bilingual synthesis only."
  }
]
