[
  {
    "id": "p003-heat-wms",
    "title": "WMS — Heat illness2024 guideline summary",
    "url": "https://wms.org/magazine/1540/Heat-Illness-CPG/default.aspx",
    "organization": "Wilderness Medical Society",
    "independence_group": "WMS",
    "type": "professional_reference",
    "jurisdiction": "US",
    "publication_date": null,
    "accessed_at": "2026-10-03",
    "retrieval_status": "page_opened",
    "retrieval_scope": "Official society summary actually read: classifications, active cooling, temperature assessment, fluids and prevention. This is the society summary, not the entire journal guideline. Selected medically supervised field-discharge exception not generalized to lay care.",
    "claim_verification": "pending",
    "copyright": "Original bilingual synthesis; source full text and figures not redistributed."
  },
  {
    "id": "p003-heat-sccm",
    "title": "SCCM2025 — Heat stroke guideline official summary",
    "url": "https://sccm.org/SCCM/media/SCCM/PDFs/HeatStroke-Infographic.pdf",
    "organization": "Society of Critical Care Medicine",
    "independence_group": "SCCM",
    "type": "professional_reference",
    "jurisdiction": "MULTI_REGION",
    "publication_date": null,
    "accessed_at": "2026-10-03",
    "retrieval_status": "page_opened",
    "retrieval_scope": "Official one-page summary actually read: active cooling over passive, cold-water immersion, same strategy for classic/exertional, againstdantrolene/routineantipyretics and preventive antibiotics/antiseizure drugs outside research. Fulljournalarticle not claimed read. No diagram or temperature table copied.",
    "claim_verification": "pending",
    "copyright": "Original bilingual synthesis; source full text and figures not redistributed."
  },
  {
    "id": "p003-heat-msd",
    "title": "MSD Professional — Heatstroke",
    "url": "https://www.msdmanuals.com/professional/injuries-poisoning/heat-illness/heatstroke",
    "organization": "MSD Manuals; Yip/Tanen, physician peer review",
    "independence_group": "MSD-MANUALS",
    "type": "professional_reference",
    "jurisdiction": "US",
    "publication_date": null,
    "accessed_at": "2026-10-03",
    "retrieval_status": "page_opened",
    "retrieval_scope": "ReviewedMay2025 updatedDecember2025. Original body read: two patterns, organ effects, differential, investigations, cooling/fluids, drug harm, prognosis. CitesWMS2024/SCCM2025/ACSM2023: shared upstream evidence.",
    "claim_verification": "pending",
    "copyright": "Original bilingual synthesis; source full text and figures not redistributed."
  },
  {
    "id": "p003-heat-yellow",
    "title": "CDC Yellow Book2026 — Heat and cold illness in travellers",
    "url": "https://www.cdc.gov/yellow-book/hcp/environmental-hazards-risks/heat-and-cold-illness-in-travelers.html",
    "organization": "CDC; Backer and Freer",
    "independence_group": "CDC",
    "type": "professional_reference",
    "jurisdiction": "US",
    "publication_date": null,
    "accessed_at": "2026-10-03",
    "retrieval_status": "page_opened",
    "retrieval_scope": "April23,2025 original heat sections/box3.2.1: physiology, classic/exertional, hyponatraemia, evacuation, cooling, hydration, acclimatization. Literal41C/104F discrepancy not copied. Oral salt recipes, skin massage and narrow ice-pack advice not prescribed.",
    "claim_verification": "pending",
    "copyright": "Original bilingual synthesis; source full text and figures not redistributed."
  },
  {
    "id": "p003-heat-medicines",
    "title": "CDC — Heat and medications: guidance for clinicians",
    "url": "https://www.cdc.gov/heat-health/hcp/clinical-guidance/heat-and-medications-guidance-for-clinicians.html",
    "organization": "Centers for Disease Control and Prevention",
    "independence_group": "CDC",
    "type": "professional_reference",
    "jurisdiction": "US",
    "publication_date": null,
    "accessed_at": "2026-10-03",
    "retrieval_status": "page_opened",
    "retrieval_scope": "September18,2025 actual mechanisms and clinician action plan. Expert opinion, not a drug-effect trial. No independent instruction to discontinue/adjust medicine or fluids.",
    "claim_verification": "pending",
    "copyright": "Original bilingual synthesis; source full text and figures not redistributed."
  },
  {
    "id": "p003-heat-mayo-causes",
    "title": "Mayo Clinic — Heatstroke symptoms and causes",
    "url": "https://www.mayoclinic.org/diseases-conditions/heat-stroke/symptoms-causes/syc-20353581",
    "organization": "Mayo Clinic",
    "independence_group": "MAYO",
    "type": "professional_reference",
    "jurisdiction": "US",
    "publication_date": null,
    "accessed_at": "2026-10-03",
    "retrieval_status": "page_opened",
    "retrieval_scope": "September12,2024 actual Causes/Risk factors/Complications/Prevention. Two patterns, hot vehicles, clothing, acclimation. CitesCDC and clinical textbooks; does not independently replicate trials.",
    "claim_verification": "pending",
    "copyright": "Original bilingual synthesis; source full text and figures not redistributed."
  },
  {
    "id": "p003-heat-mayo-treatment",
    "title": "Mayo Clinic — Heatstroke diagnosis and treatment",
    "url": "https://www.mayoclinic.org/diseases-conditions/heat-stroke/diagnosis-treatment/drc-20353587",
    "organization": "Mayo Clinic",
    "independence_group": "MAYO",
    "type": "professional_reference",
    "jurisdiction": "US",
    "publication_date": null,
    "accessed_at": "2026-10-03",
    "retrieval_status": "page_opened",
    "retrieval_scope": "September12,2024 actual diagnosis, immersion/evaporative cooling, drugs for shivering, firstaid, restricted fluid/salt. Drug forshivering onlyprofessionals; no prescribed doses.",
    "claim_verification": "pending",
    "copyright": "Original bilingual synthesis; source full text and figures not redistributed."
  },
  {
    "id": "p003-heat-cleveland",
    "title": "Cleveland Clinic — Heat stroke",
    "url": "https://my.clevelandclinic.org/health/diseases/21812-heatstroke",
    "organization": "Cleveland Clinic",
    "independence_group": "CLEVELAND",
    "type": "professional_reference",
    "jurisdiction": "US",
    "publication_date": null,
    "accessed_at": "2026-10-03",
    "retrieval_status": "page_opened",
    "retrieval_scope": "Original fullpatient body read viaurllib: patterns including exertion in normal weather, risks, tests, organ complications, residual neurological difficulties, recovery and prevention. No outcome percentages reused.",
    "claim_verification": "pending",
    "copyright": "Original bilingual synthesis; source full text and figures not redistributed."
  },
  {
    "id": "p003-heat-nata",
    "title": "NATA2015 — Exertional heat illnesses position statement",
    "url": "https://pmc.ncbi.nlm.nih.gov/articles/PMC4639891/",
    "organization": "National Athletic Trainers Association; Casa and colleagues",
    "independence_group": "NATA",
    "type": "professional_reference",
    "jurisdiction": "US",
    "publication_date": null,
    "accessed_at": "2026-10-03",
    "retrieval_status": "article_retrieved",
    "retrieval_scope": "Original authored statement onPMC, definition/recognition and recommendations43–48 Return to Activity read. Stilllisted byNATA; older consensus recommendations, no fixed7–21day clearance rule transferred to every patient. PMC is hosting not author.",
    "claim_verification": "pending",
    "copyright": "Original bilingual synthesis; source full text and figures not redistributed."
  },
  {
    "id": "p003-heat-who",
    "title": "WHO — Heat and health",
    "url": "https://www.who.int/news-room/fact-sheets/detail/climate-change-heat-and-health",
    "organization": "World Health Organization",
    "independence_group": "WHO",
    "type": "professional_reference",
    "jurisdiction": "GLOBAL",
    "publication_date": null,
    "accessed_at": "2026-10-03",
    "retrieval_status": "page_opened",
    "retrieval_scope": "Actual current fact sheet read: vulnerability, cool home/body, checking others and parked-vehicle prevention. Generic fluid quotas not applied to people with restriction. No population mortality data reused.",
    "claim_verification": "pending",
    "copyright": "Original bilingual synthesis; source full text and figures not redistributed."
  }
]
