[
  {
    "id": "p003-neonatal-sepsis-nice",
    "title": "Neonatal infection: antibiotics for prevention and treatment (NG195)",
    "url": "https://www.nice.org.uk/guidance/ng195",
    "organization": "NICE",
    "independence_group": "UK-NICE",
    "type": "professional_guideline",
    "jurisdiction": "GB",
    "publication_date": null,
    "accessed_at": "2026-10-03",
    "retrieval_status": "page_opened",
    "retrieval_scope": "2026 split official chapters, read with urllib: Information/support 1.1-1.5; Prevention 1.6-1.8; early indicators 1.9-1.11; late indicators 1.12; investigations 1.13-1.14; antibiotic principles 1.15-1.16; gentamicin 1.35-1.36; discharge 1.37-1.38. Web403; official urllib HTML succeeded. Diagnostic CRP restriction updated2026.",
    "claim_verification": "pending",
    "copyright": "原文版权归来源机构；仅概括并链接，不转载全文。"
  },
  {
    "id": "p003-neonatal-sepsis-rch",
    "title": "Neonatal antimicrobial guidelines",
    "url": "https://www.rch.org.au/clinicalguide/guideline_index/Neonatal_antimicrobial_guidelines/",
    "organization": "Royal Children’s Hospital Melbourne",
    "independence_group": "AU-RCH",
    "type": "professional_guideline",
    "jurisdiction": "AU",
    "publication_date": null,
    "accessed_at": "2026-10-03",
    "retrieval_status": "page_opened",
    "retrieval_scope": "January2025; actual full official HTML: background, EOS/LOS organisms, investigation, management, empirical choices, duration and references. RCH draws on ASID and NICE; distinct editorial body but shared studies.",
    "claim_verification": "pending",
    "copyright": "原文版权归来源机构；仅概括并链接，不转载全文。"
  },
  {
    "id": "p003-neonatal-sepsis-recognition",
    "title": "Recognition of the seriously unwell neonate and young infant",
    "url": "https://www.rch.org.au/clinicalguide/guideline_index/Recognition_of_the_seriously_unwell_neonate_and_young_infant/",
    "organization": "Royal Children’s Hospital Melbourne",
    "independence_group": "AU-RCH",
    "type": "professional_guideline",
    "jurisdiction": "AU",
    "publication_date": null,
    "accessed_at": "2026-10-03",
    "retrieval_status": "page_opened",
    "retrieval_scope": "May2025; actual full HTML history/exam, differentials, investigations, management and transfer. Same RCH family, not independent of RCH neonatal antimicrobials.",
    "claim_verification": "pending",
    "copyright": "原文版权归来源机构；仅概括并链接，不转载全文。"
  },
  {
    "id": "p003-neonatal-sepsis-who",
    "title": "WHO recommendations for management of serious bacterial infections in infants aged 0–59 days",
    "url": "https://www.ncbi.nlm.nih.gov/sites/books/NBK610598/",
    "organization": "World Health Organization",
    "independence_group": "WHO",
    "type": "professional_guideline",
    "jurisdiction": "GLOBAL",
    "publication_date": null,
    "accessed_at": "2026-10-03",
    "retrieval_status": "page_opened",
    "retrieval_scope": "2024-12-08; actual WHO original hosted by NCBI, chapter3 A.1-A.3, B.2, C clinical judgement/referral/support/AMR and executive introduction long-term disability. NCBI is a host, not independent NIH endorsement. WHO IRIS PDF failed; /sites/books HTML succeeded.",
    "claim_verification": "pending",
    "copyright": "原文版权归来源机构；仅概括并链接，不转载全文。"
  },
  {
    "id": "p003-neonatal-sepsis-cdc",
    "title": "Preventing Group B Strep Disease in Newborns",
    "url": "https://www.cdc.gov/group-b-strep/prevention/index.html",
    "organization": "US Centers for Disease Control and Prevention",
    "independence_group": "US-CDC",
    "type": "professional_guideline",
    "jurisdiction": "US",
    "publication_date": null,
    "accessed_at": "2026-10-03",
    "retrieval_status": "page_opened",
    "retrieval_scope": "May1,2025; actual full official prevention page: maternal screening and intrapartum IV antibiotics reduce first-week disease. US universal screening differs from NICE risk-based approach.",
    "claim_verification": "pending",
    "copyright": "原文版权归来源机构；仅概括并链接，不转载全文。"
  },
  {
    "id": "p003-neonatal-sepsis-gentamicin",
    "title": "Neonatal medicine: Gentamicin",
    "url": "https://www.health.qld.gov.au/__data/assets/pdf_file/0023/945320/nmq-gentamicin.pdf",
    "organization": "Queensland Clinical Guidelines",
    "independence_group": "AU-QCG",
    "type": "professional_guideline",
    "jurisdiction": "AU",
    "publication_date": null,
    "accessed_at": "2026-10-03",
    "retrieval_status": "page_opened",
    "retrieval_scope": "NMedQ25.038-V4-R30 effective2025-10-21; actual PDF all4pages: indication, dose individualisation, renal function/HIE, monitoring and nephro/ototoxicity. Trough timing differs from NICE; no universal schedule copied.",
    "claim_verification": "pending",
    "copyright": "原文版权归来源机构；仅概括并链接，不转载全文。"
  },
  {
    "id": "p003-neonatal-sepsis-who-summary",
    "title": "WHO 2024 serious bacterial infections in infants0–59days — Executive summary",
    "url": "https://www.ncbi.nlm.nih.gov/sites/books/NBK610594/",
    "organization": "World Health Organization",
    "independence_group": "WHO",
    "type": "professional_guideline",
    "jurisdiction": "GLOBAL",
    "publication_date": null,
    "accessed_at": "2026-10-03",
    "retrieval_status": "page_opened",
    "retrieval_scope": "Same WHO2024 book, original Executive summary Background37–49: long-term disability after serious bacterial infection, organ dysfunction, diagnostic and evidence limits. Original WHO text: root read HTML; independent reviewer read official-source indexed Executive summary Background; NCBI is hosting WHO, not independent NIH authorship.",
    "claim_verification": "pending",
    "copyright": "原文版权归来源机构；仅概括并链接，不转载全文。"
  },
  {
    "id": "p003-neonatal-sepsis-nice-surveillance",
    "title": "NICE NG195 — 2022 exceptional surveillance: neonatal gentamicin",
    "url": "https://www.nice.org.uk/guidance/ng195/resources/2022-exceptional-surveillance-of-neonatal-infection-antibiotics-for-prevention-and-treatment-nice-guideline-ng195-11201548285/chapter/Surveillance-decision?tab=evidence",
    "organization": "NICE",
    "independence_group": "UK-NICE",
    "type": "professional_guideline",
    "jurisdiction": "GB",
    "publication_date": null,
    "accessed_at": "2026-10-03",
    "retrieval_status": "page_opened",
    "retrieval_scope": "2022 exceptional surveillance original NICE HTML via urllib; Reasons for the decision, Topic expert feedback, Information considered when developing guideline. Actual read: ototoxicity/nephrotoxicity assessment balanced against urgent neonatal infection treatment; no routine delay to obtain initial drug levels. Same NICE editorial group as2026 NG195.",
    "claim_verification": "pending",
    "copyright": "原文版权归来源机构；仅概括并链接，不转载全文。"
  }
]
