[
  {
    "id": "p003-asphyxia-aha",
    "title": "2025 AHA/AAP Neonatal Resuscitation",
    "url": "https://cpr.heart.org/en/resuscitation-science/cpr-and-ecc-guidelines/neonatal-resuscitation",
    "organization": "AHA and AAP",
    "independence_group": "US-AHA-AAP",
    "type": "professional_guideline",
    "jurisdiction": "US",
    "publication_date": null,
    "accessed_at": "2026-10-03",
    "retrieval_status": "page_opened",
    "retrieval_scope": "2025 guideline; actual official HTML abstract, preparation, temperature, ventilation, chest compressions, medications and section17 post-resuscitation. Shared ILCOR evidence, AAP reprint not an independent source. 2025 recommendation does not support routine cooling below36weeks.",
    "claim_verification": "pending",
    "copyright": "仅原创概括，版权归原机构。"
  },
  {
    "id": "p003-asphyxia-qcg",
    "title": "Hypoxic ischaemic encephalopathy",
    "url": "https://www.health.qld.gov.au/__data/assets/pdf_file/0014/140162/g-hie.pdf",
    "organization": "Queensland Clinical Guidelines",
    "independence_group": "AU-QCG",
    "type": "professional_guideline",
    "jurisdiction": "AU",
    "publication_date": null,
    "accessed_at": "2026-10-03",
    "retrieval_status": "page_opened",
    "retrieval_scope": "MN21.11-V12-R26 December2021 amendedJuly2024. Actual official PDF p3-4 pathways, p11-15 diagnosis/staging/initialcare, p20-22 organ support/nutrition/sedation/cooling, p24-26 imaging/outcomes/discharge. Web PDF succeeded; urllib403. Historical35week cooling threshold not adopted against newer2025AHA evidence.",
    "claim_verification": "pending",
    "copyright": "仅原创概括，版权归原机构。"
  },
  {
    "id": "p003-asphyxia-cps",
    "title": "Hypothermia for newborns with hypoxic-ischemic encephalopathy",
    "url": "https://cps.ca/en/documents/position/hypothermia-for-newborns",
    "organization": "Canadian Paediatric Society",
    "independence_group": "CA-CPS",
    "type": "professional_guideline",
    "jurisdiction": "CA",
    "publication_date": null,
    "accessed_at": "2026-10-03",
    "retrieval_status": "page_opened",
    "retrieval_scope": "2018-06-12 reaffirmed2024-01-11. Actual official HTML and urllib text: background, eligibility, exclusion, adverse effects, adjuncts including feeding, MRI and multidisciplinary follow-up. Shares cooling trials with QCG/AHA; older35week suggestion not generalized.",
    "claim_verification": "pending",
    "copyright": "仅原创概括，版权归原机构。"
  },
  {
    "id": "p003-asphyxia-who",
    "title": "WHO Perinatal asphyxia",
    "url": "https://www.who.int/teams/maternal-newborn-child-adolescent-health-and-ageing/newborn-health/perinatal-asphyxia",
    "organization": "World Health Organization",
    "independence_group": "WHO",
    "type": "professional_guideline",
    "jurisdiction": "GLOBAL",
    "publication_date": null,
    "accessed_at": "2026-10-03",
    "retrieval_status": "page_opened",
    "retrieval_scope": "Actual entire official overview: failure to establish breathing, delivery complications, drying/warming/stimulation and assisted ventilation, systems/training/followup. 2012 guideline is historical; WHO June2026 update-development announcement is not a new completed guideline.",
    "claim_verification": "pending",
    "copyright": "仅原创概括，版权归原机构。"
  },
  {
    "id": "p003-neonatal-sepsis-recognition",
    "title": "Recognition of the seriously unwell neonate and young infant",
    "url": "https://www.rch.org.au/clinicalguide/guideline_index/Recognition_of_the_seriously_unwell_neonate_and_young_infant/",
    "organization": "Royal Children’s Hospital Melbourne",
    "independence_group": "AU-RCH",
    "type": "professional_guideline",
    "jurisdiction": "AU",
    "publication_date": null,
    "accessed_at": "2026-10-03",
    "retrieval_status": "page_opened",
    "retrieval_scope": "May2025; actual full HTML history/exam, differentials, investigations, management and transfer. Same RCH family, not independent of RCH neonatal antimicrobials.",
    "claim_verification": "pending",
    "copyright": "原文版权归来源机构；仅概括并链接，不转载全文。"
  },
  {
    "id": "p003-asphyxia-qcg-resuscitation",
    "title": "Queensland Clinical Guidelines — Neonatal resuscitation",
    "url": "https://www.health.qld.gov.au/__data/assets/pdf_file/0011/140600/g-resus.pdf",
    "organization": "Queensland Health",
    "independence_group": "AU-QCG",
    "type": "professional_guideline",
    "jurisdiction": "AU",
    "publication_date": null,
    "accessed_at": "2026-10-03",
    "retrieval_status": "page_opened",
    "retrieval_scope": "MN22.5-V6-R27 October2022; review October2027. Actual original PDF page24 section5/Table23 ventilation before compressions; page26 section6.2/Table25 epinephrine; page27 section6.3/Table26 indicated fluids or blood. Root read indexed original passages; same QCG group as HIE, shares ANZCOR/ILCOR upstream with AHA. No dose or numeric threshold added.",
    "claim_verification": "pending",
    "copyright": "Queensland2022 original CC BY-NC-ND4.0; source PDF not redistributed or adapted. Original concise factual synthesis and link retained."
  }
]
