[
  {
    "id": "p003-msf-uterine-rupture",
    "title": "MSF — Uterine rupture",
    "url": "https://medicalguidelines.msf.org/en/viewport/ONC/english/3-3-uterine-rupture-51416296.html",
    "organization": "Médecins Sans Frontières",
    "independence_group": "MSF",
    "type": "professional_guideline",
    "jurisdiction": "MULTI_REGION",
    "publication_date": null,
    "accessed_at": "2026-10-03",
    "retrieval_status": "page_opened",
    "retrieval_scope": "2026-10-03 urllib official HTML actually read:3.3.1 risk/obstruction;3.3.2 intrapartum and postpartum recognition;3.3.3 surgery, resuscitation, future rupture. Web tool405 bypassed using official direct request; no figure interpretation. Figure adapted Primary Surgery; not a separate independent source.",
    "claim_verification": "pending",
    "copyright": "Original bilingual synthesis and links only; no full source redistribution."
  },
  {
    "id": "p003-msf-obstructed-labour",
    "title": "MSF — Obstructed labour",
    "url": "https://medicalguidelines.msf.org/en/viewport/ONC/english/7-2-obstructed-labour-51417478.html",
    "organization": "Médecins Sans Frontières",
    "independence_group": "MSF",
    "type": "professional_guideline",
    "jurisdiction": "MULTI_REGION",
    "publication_date": null,
    "accessed_at": "2026-10-03",
    "retrieval_status": "page_opened",
    "retrieval_scope": "Official HTML actually read by urllib:7.2 definition;7.2.2 causes;7.2.3 complications;7.2.4 atony-related PPH;7.2.5 fistula. Shares WHO fistula guidance; counted with MSF3.3 as one origin. Does not import >24h definition as a waiting rule, fluid targets or procedures.",
    "claim_verification": "pending",
    "copyright": "Original bilingual synthesis and links only; no full source redistribution."
  },
  {
    "id": "p003-who-obstructed-labour",
    "title": "WHO — Midwifery education modules: managing prolonged and obstructed labour, second edition",
    "url": "https://cdn.who.int/media/docs/default-source/mca-documents/maternal-nb/midwifery/midwifery-education-module_3_managing-prolonged-and-obstructed-labour.pdf",
    "organization": "World Health Organization",
    "independence_group": "WHO",
    "type": "professional_guideline",
    "jurisdiction": "GLOBAL",
    "publication_date": null,
    "accessed_at": "2026-10-03",
    "retrieval_status": "page_opened",
    "retrieval_scope": "Original WHO PDF web text actually read:physical pages33(rupture/haemorrhage),59(recognition),201(definition mechanical obstruction),204(PPH atony/trauma glossary); edition2 confirmed on physical page3. Historical education used only for mechanisms, not old partograph timings or PPH numerical thresholds. urllib403; web PDF succeeds. MSF/WHO share obstetric evidence; separate editorial origins, no independent-trial assertion.",
    "claim_verification": "pending",
    "copyright": "Original bilingual synthesis and links only; no full source redistribution."
  },
  {
    "id": "p003-rcog-birth-after-caesarean",
    "title": "RCOG — Birth After Previous Caesarean Birth, Green-top45",
    "url": "https://www.rcog.org.uk/media/kpkjwd5h/gtg_45.pdf",
    "organization": "Royal College of Obstetricians and Gynaecologists",
    "independence_group": "UK-RCOG",
    "type": "professional_guideline",
    "jurisdiction": "GB",
    "publication_date": null,
    "accessed_at": "2026-10-03",
    "retrieval_status": "page_opened",
    "retrieval_scope": "October2015 edition2 (exact day unavailable), original PDF physical pages1–5 actually read. Page2 contraindication of planned VBAC with previous rupture and case-by-case senior assessment of complex scars. Historical guidance supports specialist future-birth discussion only; no timing or numeric recurrence estimate imported.",
    "claim_verification": "pending",
    "copyright": "Original bilingual synthesis and links only; no full source redistribution."
  },
  {
    "id": "p003-aha-international-2020",
    "title": "International recommendations on diagnosis and treatment of acquired hemophilia A",
    "url": "https://haematologica.org/article/view/9931",
    "organization": "International expert panel, Haematologica",
    "independence_group": "AHA-INTERNATIONAL-2020",
    "type": "professional_guideline",
    "jurisdiction": "MULTI_REGION",
    "publication_date": null,
    "accessed_at": "2026-10-03",
    "retrieval_status": "page_opened",
    "retrieval_scope": "2020; accepted2020-04-07. Original full relevant HTML read:Introduction58–63;Diagnosis82–105;Hemostatic treatment109–126;Follow-up216–219;Pregnancy-associated AHA220–223;disclosures229. Consensus with EACH2/GTH registry evidence, editorial support funded by Novo Nordisk. Not independent trial replication.",
    "claim_verification": "pending",
    "copyright": "Original bilingual synthesis and links only; no full source redistribution."
  },
  {
    "id": "p003-nhc-rare-aha-2025",
    "title": "86个罕见病病种诊疗指南 — 获得性血友病",
    "url": "https://www.gov.cn/zhengce/zhengceku/202507/P020250710595668350272.pdf",
    "organization": "中国政府网发布的罕见病诊疗指南",
    "independence_group": "CN-RARE-DISEASE-GUIDELINE",
    "type": "professional_guideline",
    "jurisdiction": "CN",
    "publication_date": null,
    "accessed_at": "2026-10-03",
    "retrieval_status": "page_opened",
    "retrieval_scope": "2025 release, precise issue day not confirmed. Official PDF downloaded in memory, pdftotext physical pages9 and11–14 actually read:chapter2 overview/diagnostics;therapy;pregnancy/lactation;complication monitoring;references. Printed pages5,7–10. Independently formulated China guidance cites international2020, EACH2 and Chinese CARE/local studies, so underlying evidence overlaps. Treatment availability and pregnancy/lactation regimens differ; do not combine drug prescriptions.",
    "claim_verification": "pending",
    "copyright": "Original bilingual synthesis and links only; no full source redistribution."
  },
  {
    "id": "p003-masac-265",
    "title": "MASAC Document 265: Pregnancy and Perinatal Management of Women with Inherited Bleeding Disorders and Carriers of Hemophilia A or B",
    "url": "https://www.bleeding.org/healthcare-professionals/guidelines-on-care/masac-documents/masac-document-265-masac-guidelines-for-pregnancy-and-perinatal-management-of-women-with-inherited-bleeding-disorders-and-carriers-of-hemophilia-a-or-b",
    "organization": "NHF/NBDF MASAC",
    "independence_group": "NHF-MASAC",
    "type": "professional_guideline",
    "jurisdiction": "US",
    "publication_date": "2021-03-04",
    "accessed_at": "2026-10-03",
    "retrieval_status": "page_opened",
    "retrieval_scope": "实际阅读官方HTML对应章节；urllib获取官方PDF并以pdftotext读取首面核日期; Preconception Diagnosis and Genetic Counseling, HTML lines 238–245; Pregnancy Management, lines 248–254; Labor and Delivery Management, lines 257–264; Postpartum Management to Prevent Bleeding, lines 289–292; References, lines 304–322; Approved2021-02-20; adopted2021-03-04. Original material was read in this agent session, not using preparation as a medical source.",
    "claim_verification": "pending",
    "copyright": "Original bilingual synthesis and links only; no full source redistribution."
  },
  {
    "id": "p003-rcog-inherited-bleeding-71",
    "title": "Management of Inherited Bleeding Disorders in Pregnancy, Green-top Guideline No.71 (joint with UKHCDO)",
    "url": "https://obgyn.onlinelibrary.wiley.com/doi/pdf/10.1111/1471-0528.14592",
    "organization": "RCOG/UKHCDO",
    "independence_group": "UK-RCOG",
    "type": "professional_guideline",
    "jurisdiction": "GB",
    "publication_date": null,
    "accessed_at": "2026-10-03",
    "retrieval_status": "page_opened",
    "retrieval_scope": "实际阅读RCOG官方落地页及其Wiley PDF链接返回的文字定位；只读下列范围，未声称通读71页。后续页获取超时、urllib 403，故未把未读VWD细节作为已核实证据。; RCOG landing Summary/Version history/Description, lines 120–127; PDF physical page 1: title and date; PDF physical page 3/e195: haemophilia prepregnancy management and genetic counselling; PDF physical page 4/e196: multidisciplinary antenatal care and factor monitoring; PDF physical page 6/e198: postpartum management, assay-guided management and post-discharge haemophilia-centre contact; April2017. UKHCDO prior guidance shared with MASAC; no independent study replication claimed.",
    "claim_verification": "pending",
    "copyright": "Original bilingual synthesis and links only; no full source redistribution."
  },
  {
    "id": "p003-who-obstetric-fistula",
    "title": "WHO — Obstetric fistula",
    "url": "https://www.who.int/news-room/facts-in-pictures/detail/10-facts-on-obstetric-fistula",
    "organization": "World Health Organization",
    "independence_group": "WHO",
    "type": "patient_education",
    "jurisdiction": "GLOBAL",
    "publication_date": "2018-02-19",
    "accessed_at": "2026-10-03",
    "retrieval_status": "page_opened",
    "retrieval_scope": "Official WHO HTML actually read 2026-10-03: introduction lines83–90, physical/mental suffering119–121, access to care140–149 and surgery155–157. Describes obstruction-related fistula and persistent incontinence; no numerical incidence, surgical success estimate or fixed catheter duration adopted. MSF separately authors practical management but cites WHO2006, so shared upstream basis is disclosed.",
    "claim_verification": "pending",
    "copyright": "Original bilingual synthesis and links only; no full source redistribution."
  }
]
