[
  {
    "id": "sjs-ten-p0-03-nhs",
    "title": "Stevens-Johnson syndrome",
    "url": "https://www.nhs.uk/conditions/stevens-johnson-syndrome/",
    "organization": "NHS",
    "independence_group": "UK-NHS",
    "type": "public_health_information",
    "jurisdiction": "GB",
    "publication_date": null,
    "accessed_at": "2026-10-03",
    "retrieval_status": "page_opened",
    "retrieval_scope": "Reviewed2026-03-04; actual read: Causes; Symptoms; immediate action; Treatments; Recovery; Complications",
    "claim_verification": "pending",
    "copyright": "Original bilingual education; source rights retained."
  },
  {
    "id": "sjs-ten-p0-03-bad",
    "title": "SJS/TEN patient information",
    "url": "https://cdn.bad.org.uk/uploads/2021/12/19173942/SJSTEN-PIL-Nov-2023-.pdf",
    "organization": "BAD",
    "independence_group": "UK-BAD",
    "type": "public_health_information",
    "jurisdiction": "GB",
    "publication_date": null,
    "accessed_at": "2026-10-03",
    "retrieval_status": "page_opened",
    "retrieval_scope": "November2023; actual read: pp1–2 entire leaflet",
    "claim_verification": "pending",
    "copyright": "Original bilingual education; source rights retained."
  },
  {
    "id": "sjs-ten-p0-03-mayo-treatment",
    "title": "Stevens-Johnson syndrome: diagnosis and treatment",
    "url": "https://www.mayoclinic.org/diseases-conditions/stevens-johnson-syndrome/diagnosis-treatment/drc-20355942",
    "organization": "Mayo Clinic",
    "independence_group": "US-MAYO",
    "type": "public_health_information",
    "jurisdiction": "US",
    "publication_date": null,
    "accessed_at": "2026-10-03",
    "retrieval_status": "page_opened",
    "retrieval_scope": "2025-04-30; actual read: Diagnosis; Treatment; Self care; Preparing for appointment",
    "claim_verification": "pending",
    "copyright": "Original bilingual education; source rights retained."
  },
  {
    "id": "sjs-ten-p0-03-vumc",
    "title": "SJS/TEN Management Guideline",
    "url": "https://www.vumc.org/burn/sites/default/files/public_files/Protocols/SJSTEN-Guidelines-2025-07.pdf",
    "organization": "Vanderbilt University Medical Center",
    "independence_group": "US-VUMC",
    "type": "public_health_information",
    "jurisdiction": "US",
    "publication_date": null,
    "accessed_at": "2026-10-03",
    "retrieval_status": "page_opened",
    "retrieval_scope": "July2025; next review July2027; actual read: pp2–5 Definitions; Initial evaluation; consultations; nutrition; wound; systemic management",
    "claim_verification": "pending",
    "copyright": "Original bilingual education; source rights retained."
  },
  {
    "id": "sjs-ten-p0-03-dermnet",
    "title": "Stevens Johnson Syndrome / Toxic Epidermal Necrolysis",
    "url": "https://dermnetnz.org/topics/stevens-johnson-syndrome-toxic-epidermal-necrolysis",
    "organization": "DermNet",
    "independence_group": "NZ-DERMNET",
    "type": "public_health_information",
    "jurisdiction": "NZ",
    "publication_date": null,
    "accessed_at": "2026-10-03",
    "retrieval_status": "page_opened",
    "retrieval_scope": "Current page; exact update date not established; actual read: Who gets; Clinical features; Diagnosis; Differentials; Treatment; Complications",
    "claim_verification": "pending",
    "copyright": "Original bilingual education; source rights retained."
  },
  {
    "id": "sjs-ten-p0-03-msd",
    "title": "MSD Manual — Stevens-Johnson syndrome and toxic epidermal necrolysis",
    "url": "https://www.msdmanuals.com/professional/dermatologic-disorders/hypersensitivity-and-reactive-skin-disorders/stevens-johnson-syndrome-sjs-and-toxic-epidermal-necrolysis-ten",
    "organization": "MSD Manual",
    "independence_group": "MSD",
    "type": "clinical_guideline",
    "jurisdiction": "US",
    "publication_date": null,
    "accessed_at": "2026-10-03",
    "retrieval_status": "page_opened",
    "retrieval_scope": "2026-09; Treatment: corticosteroid uncertainty, infection/sepsis concerns and possible benefit from early therapy; original HTML successfully read with urllib after web offset timeout.",
    "claim_verification": "pending",
    "copyright": "Original bilingual synthesis; no source text or images reproduced."
  },
  {
    "id": "sjs-ten-p0-03-rime",
    "title": "DermNet — Reactive infectious mucocutaneous eruption",
    "url": "https://dermnetnz.org/topics/reactive-infectious-mucocutaneous-eruption",
    "organization": "DermNet",
    "independence_group": "NZ-DERMNET",
    "type": "clinical_guideline",
    "jurisdiction": "NZ",
    "publication_date": null,
    "accessed_at": "2026-10-03",
    "retrieval_status": "page_opened",
    "retrieval_scope": "2025-06; Introduction83–94; Clinical features131–150; Diagnosis164–175 and differential176–183: mucosal predominant postinfectious illness, mainly children, sparse skin involvement.",
    "claim_verification": "pending",
    "copyright": "Original bilingual synthesis; no source text or images reproduced."
  }
]
