[
  {
    "id": "severe-dengue-p0-03-cdc-care",
    "title": "Clinical Care of Dengue",
    "url": "https://www.cdc.gov/dengue/hcp/clinical-care/index.html",
    "organization": "CDC",
    "independence_group": "US-CDC",
    "type": "clinical_guideline",
    "jurisdiction": "US",
    "publication_date": null,
    "accessed_at": "2026-10-03",
    "retrieval_status": "page_opened",
    "retrieval_scope": "2026-04-15; actual read Warning Signs; Groups A/B1/B2/C; severe dengue fluid/transfusion management",
    "claim_verification": "pending",
    "copyright": "Original bilingual educational text; source rights retained."
  },
  {
    "id": "severe-dengue-p0-03-cdc-tests",
    "title": "Clinical Testing Guidance for Dengue",
    "url": "https://www.cdc.gov/dengue/hcp/diagnosis-testing/index.html",
    "organization": "CDC",
    "independence_group": "US-CDC",
    "type": "clinical_guideline",
    "jurisdiction": "US",
    "publication_date": null,
    "accessed_at": "2026-10-03",
    "retrieval_status": "page_opened",
    "retrieval_scope": "2025-08-26; actual read Key points; acute/convalescent phase; interpreting results; pregnancy",
    "claim_verification": "pending",
    "copyright": "Original bilingual educational text; source rights retained."
  },
  {
    "id": "severe-dengue-p0-03-who",
    "title": "Dengue and severe dengue",
    "url": "https://www.who.int/news-room/fact-sheets/detail/dengue-and-severe-dengue",
    "organization": "WHO",
    "independence_group": "WHO",
    "type": "clinical_guideline",
    "jurisdiction": "Global",
    "publication_date": null,
    "accessed_at": "2026-10-03",
    "retrieval_status": "page_opened",
    "retrieval_scope": "Current fact sheet; accessed2026-10-03; actual read Overview; Symptoms; Prevention and control",
    "claim_verification": "pending",
    "copyright": "Original bilingual educational text; source rights retained."
  },
  {
    "id": "severe-dengue-p0-03-nhs",
    "title": "Dengue",
    "url": "https://www.nhs.uk/conditions/dengue/",
    "organization": "NHS",
    "independence_group": "UK-NHS",
    "type": "clinical_guideline",
    "jurisdiction": "GB",
    "publication_date": null,
    "accessed_at": "2026-10-03",
    "retrieval_status": "page_opened",
    "retrieval_scope": "Reviewed2026-08-13; actual read Severe dengue; Treatments; Risk groups; Prevention/vaccination",
    "claim_verification": "pending",
    "copyright": "Original bilingual educational text; source rights retained."
  },
  {
    "id": "severe-dengue-p0-03-sg2026",
    "title": "Singapore National Dengue Clinical Guideline",
    "url": "https://isomer-user-content.by.gov.sg/68/d5527384-0c8a-44d5-8c20-71715ea784bc/Singapore%20National%20Dengue%20Clinical%20Guideline%20(Mar%202026)%20%5BPDF%5D.pdf",
    "organization": "Singapore national expert group / NCID",
    "independence_group": "SG-NATIONAL",
    "type": "clinical_guideline",
    "jurisdiction": "SG",
    "publication_date": null,
    "accessed_at": "2026-10-03",
    "retrieval_status": "page_opened",
    "retrieval_scope": "March2026; actual read pp3–5 special populations/differentials/testing; pp6–11 monitoring/fluids/discharge/pregnancy; p16 transfusion",
    "claim_verification": "pending",
    "copyright": "Original bilingual educational text; source rights retained."
  },
  {
    "id": "severe-dengue-p0-03-cda",
    "title": "Dengue fever",
    "url": "https://www.cda.gov.sg/professionals/diseases/dengue-fever/",
    "organization": "Communicable Diseases Agency",
    "independence_group": "SG-NATIONAL",
    "type": "clinical_guideline",
    "jurisdiction": "SG",
    "publication_date": null,
    "accessed_at": "2026-10-03",
    "retrieval_status": "page_opened",
    "retrieval_scope": "2026-09-04; actual read Transmission; Diagnosis; Treatment; Prevention/vaccine availability",
    "claim_verification": "pending",
    "copyright": "Original bilingual educational text; source rights retained."
  },
  {
    "id": "severe-dengue-p0-03-india2023",
    "title": "National Guidelines for Clinical Management of Dengue Fever 2023",
    "url": "https://ncvbdc.mohfw.gov.in/Doc/National%20Guidelines%20for%20Clinical%20Management%20of%20Dengue%20Fever%202023.pdf",
    "organization": "National Center for Vector Borne Diseases Control, Ministry of Health and Family Welfare",
    "independence_group": "IN-NCVBDC",
    "type": "clinical_guideline",
    "jurisdiction": "IN",
    "publication_date": null,
    "accessed_at": "2026-10-03",
    "retrieval_status": "page_opened",
    "retrieval_scope": "2023; actual original PDF read: PDF70/printed48 section8.1 coronary disease: antiplatelet/anticoagulant individual monitoring; PDF82/printed60 Chapter13 recovery and discharge criteria",
    "claim_verification": "pending",
    "copyright": "Original bilingual educational text; source rights retained."
  },
  {
    "id": "severe-dengue-p0-03-hsajb",
    "title": "Standard Operating Procedures and Contingency Plan for Management of Dengue Patients",
    "url": "https://jknjohor.moh.gov.my/hsajb/index.php/warga-hsa1/muat-turun-borang/category/216-dengue-management?download=2085:hsajb-sop-and-contingency-plan-for-management-of-dengue-patients",
    "organization": "Hospital Sultanah Aminah Johor Bahru, Ministry of Health Malaysia",
    "independence_group": "MY-HSAJB",
    "type": "clinical_guideline",
    "jurisdiction": "MY",
    "publication_date": null,
    "accessed_at": "2026-10-03",
    "retrieval_status": "page_opened",
    "retrieval_scope": "Official current PDF accessed2026-10-03; actual original PDF read: Section6.3 printed16–17/PDF27–28 adult follow-up FBC/LFT and clinical review; section7.5 printed20/PDF31 children clinical review and FBC if needed",
    "claim_verification": "pending",
    "copyright": "Original bilingual educational text; source rights retained."
  }
]
