[
  {
    "id": "anaphylaxis-p0-03-latex-aaaai",
    "title": "Latex Allergy",
    "url": "https://www.aaaai.org/tools-for-the-public/conditions-library/allergies/latex-allergy",
    "organization": "AAAAI",
    "independence_group": "US-AAAAI",
    "type": "public_health_information",
    "jurisdiction": "US",
    "publication_date": null,
    "accessed_at": "2026-10-03",
    "retrieval_status": "page_opened",
    "retrieval_scope": "2026-06-18; 实际阅读 Reactions to Latex; Treating Latex Allergy; lines30–51",
    "claim_verification": "pending",
    "copyright": "Source rights retained; original bilingual explanation; no reproduced source text or images."
  },
  {
    "id": "anaphylaxis-p0-03-latex-ascia",
    "title": "Latex Allergy FAQ",
    "url": "https://www.allergy.org.au/patients/other-allergy/latex-allergy",
    "organization": "ASCIA",
    "independence_group": "AU-ASCIA",
    "type": "public_health_information",
    "jurisdiction": "AU-NZ",
    "publication_date": null,
    "accessed_at": "2026-10-03",
    "retrieval_status": "page_opened",
    "retrieval_scope": "August2024; 实际阅读 Q1–9, lines531–616",
    "claim_verification": "pending",
    "copyright": "Source rights retained; original bilingual explanation; no reproduced source text or images."
  },
  {
    "id": "anaphylaxis-p0-03-chlorhexidine-ascia",
    "title": "Chlorhexidine Allergy FAQ",
    "url": "https://www.allergy.org.au/images/pc/ASCIA_PC_Chlorhexidine_Allergy_2024.pdf",
    "organization": "ASCIA / ANZAAG",
    "independence_group": "AU-ASCIA",
    "type": "public_health_information",
    "jurisdiction": "AU-NZ",
    "publication_date": null,
    "accessed_at": "2026-10-03",
    "retrieval_status": "page_opened",
    "retrieval_scope": "June2024; 实际阅读 pp1–3 Q1–7",
    "claim_verification": "pending",
    "copyright": "Source rights retained; original bilingual explanation; no reproduced source text or images."
  },
  {
    "id": "anaphylaxis-p0-03-chlorhexidine-mhra",
    "title": "Chlorhexidine: risk of anaphylactic reaction",
    "url": "https://www.gov.uk/drug-device-alerts/medical-device-alert-all-medical-devices-and-medicinal-products-containing-chlorhexidine-risk-of-anaphylactic-reaction-due-to-chlorhexidine-allergy",
    "organization": "MHRA",
    "independence_group": "UK-MHRA",
    "type": "public_health_information",
    "jurisdiction": "GB",
    "publication_date": null,
    "accessed_at": "2026-10-03",
    "retrieval_status": "page_opened",
    "retrieval_scope": "Issued2012-10-25; published2014-12-17; 实际阅读 Device; Problem; Action, lines86–106",
    "claim_verification": "pending",
    "copyright": "Source rights retained; original bilingual explanation; no reproduced source text or images."
  },
  {
    "id": "anaphylaxis-p0-03-hives-ascia",
    "title": "Hives FAQ",
    "url": "https://www.allergy.org.au/images/pc/ASCIA_PC_Hives_urticaria_2024.pdf",
    "organization": "ASCIA",
    "independence_group": "AU-ASCIA",
    "type": "public_health_information",
    "jurisdiction": "AU-NZ",
    "publication_date": null,
    "accessed_at": "2026-10-03",
    "retrieval_status": "page_opened",
    "retrieval_scope": "June2024; 实际阅读 pp1–2 Q3–7",
    "claim_verification": "pending",
    "copyright": "Source rights retained; original bilingual explanation; no reproduced source text or images."
  },
  {
    "id": "anaphylaxis-p0-03-spd-mastocytosis-2018",
    "title": "spd-mastocytosis-2018",
    "url": "https://pedsderm.net/site/assets/files/1028/spd_mastocytosis_color_web.pdf",
    "organization": "Society for Pediatric Dermatology",
    "independence_group": "US-SPD",
    "type": "public_health_information",
    "jurisdiction": "美国",
    "publication_date": null,
    "accessed_at": "2026-10-03",
    "retrieval_status": "page_opened",
    "retrieval_scope": "Pediatric Dermatology 35(4), 2018; handout #23; 实际阅读 p1 ARE THERE ANY COMPLICATIONS OF MASTOCYTOSIS?; p2 CHECK-UPS WITH YOUR DOCTOR; p2 MANAGING MASTOCYTOSIS / POSSIBLE TRIGGERS",
    "claim_verification": "pending",
    "copyright": "Source rights retained; original bilingual explanation; no reproduced source text or images."
  },
  {
    "id": "anaphylaxis-p0-03-bad-urticaria-pigmentosa-2020",
    "title": "bad-urticaria-pigmentosa-2020",
    "url": "https://cdn.bad.org.uk/uploads/2021/12/29200249/Urticaria-Pigmentosa-Update-June-2020-lay-reviewed-May-2020.pdf",
    "organization": "British Association of Dermatologists",
    "independence_group": "UK-BAD",
    "type": "public_health_information",
    "jurisdiction": "英国",
    "publication_date": null,
    "accessed_at": "2026-10-03",
    "retrieval_status": "page_opened",
    "retrieval_scope": "Updated June 2020; lay reviewed May 2020; review due June 2023; 实际阅读 p2 What are the symptoms of urticaria pigmentosa?; p4 Self care (What can I do?): adrenaline, new medicine and operation paragraphs",
    "claim_verification": "pending",
    "copyright": "Source rights retained; original bilingual explanation; no reproduced source text or images."
  },
  {
    "id": "anaphylaxis-p0-03-ascia-mast-cell-disorders-2025",
    "title": "ascia-mast-cell-disorders-2025",
    "url": "https://www.allergy.org.au/images/stories/pospapers/ASCIA_HP_Mast_Cell_Disorders_2025.pdf",
    "organization": "Australasian Society of Clinical Immunology and Allergy",
    "independence_group": "AU-ASCIA",
    "type": "public_health_information",
    "jurisdiction": "澳大利亚和新西兰",
    "publication_date": null,
    "accessed_at": "2026-10-03",
    "retrieval_status": "page_opened",
    "retrieval_scope": "Updated December 2025; 实际阅读 p2 definitions; p3 Table 1: Monoclonal mast cell activation syndromes (MMAS); p8 Table 3; p9 Management of MCAS, lines 375–409 in extracted PDF; p10 references, especially reference 11",
    "claim_verification": "pending",
    "copyright": "Source rights retained; original bilingual explanation; no reproduced source text or images."
  },
  {
    "id": "anaphylaxis-p0-03-serum-who",
    "title": "WHO SEARO antivenom reaction guidance",
    "url": "https://cdn.who.int/media/docs/default-source/searo/india/health-topic-pdf/who-guidance-on-management-of-snakebites.pdf",
    "organization": "WHO SEARO",
    "independence_group": "WHO",
    "type": "clinical_guideline",
    "jurisdiction": "South-East Asia",
    "publication_date": null,
    "accessed_at": "2026-10-03",
    "retrieval_status": "page_opened",
    "retrieval_scope": "Guidelines for management of snakebites, second edition2016; Section6.7.5 antivenom reactions, including6.7.5.4 treatment; printed pp131–135 (PDF pages134–138); resuming antivenom after reaction control printed p135. Section6.7.6 is storage and is not cited for treatment.",
    "claim_verification": "pending",
    "copyright": "Original bilingual summary; rights retained."
  },
  {
    "id": "anaphylaxis-p0-03-serum-rch",
    "title": "Royal Children’s Hospital Melbourne antivenom reaction guidance",
    "url": "https://www.rch.org.au/clinicalguide/guideline_index/Envenomation_and_Bites/",
    "organization": "Royal Children’s Hospital Melbourne",
    "independence_group": "AU-RCH",
    "type": "clinical_guideline",
    "jurisdiction": "Victoria Australia",
    "publication_date": null,
    "accessed_at": "2026-10-03",
    "retrieval_status": "page_opened",
    "retrieval_scope": "UpdatedJanuary2018; actual read Giving Antivenom; Other management considerations; Consider discharge, lines165–206",
    "claim_verification": "pending",
    "copyright": "Original bilingual summary; rights retained."
  }
]
